{
  "note_id": "mianfei-ai-xie-xiaoshuo",
  "language": "zh",
  "platform": "xiaohongshu",
  "keyword": "免费AI写小说软件",
  "title": "免费AI写小说，这5个够用了✍️",
  "body": "刷到一堆『免费AI写小说』榜单，点进去不是要开会员，就是要自己接口付费😅 我整理了下，『免费』其实分三种，搞懂再选就不踩坑👇\n\n①真免费的国产大模型\nDeepSeek 逻辑强，适合先搭骨架、理时间线；豆包、文心一言中文顺，起稿和润色都行，网页端基本不花钱👍\n\n②网文垂类的免费档\n笔灵AI 懂网文，能出大纲和全篇，新手卡文很救急；蛙蛙写作还能投稿签约，奔着连载去的可以试～\n\n③免费软件但要自己接API\n技术党可以玩，按量付费，胜在能写超长篇⚙️\n\n两个大实话：ChatGPT、Claude 文笔好，但在国内要特殊网络；通用大模型写长篇容易『失忆』，连载还是垂类工具更稳。\n\n按你的需求选就行，别被『免费无限』四个字带偏啦📌 你在用哪个？评论区聊聊～",
  "tags": ["AI写小说", "AI写作工具", "免费工具", "网文", "写作干货"],
  "cover_hint": "封面大字『免费AI写小说』+ 三个桶（真免费/免费档/自接API）的对比图。",
  "images_hint": 6
}
